{
  "$schema": "https://json-schema.org/draft/2020-12/schema",
  "$id": "https://noetheon.github.io/vuln-prioritizer/schemas/evidence-bundle-manifest.schema.json",
  "title": "vuln-prioritizer evidence bundle manifest",
  "description": "Manifest contract stored as `manifest.json` inside `report evidence-bundle` ZIP exports.",
  "type": "object",
  "additionalProperties": true,
  "required": [
    "schema_version",
    "bundle_kind",
    "generated_at",
    "source_analysis_path",
    "included_input_copy",
    "files"
  ],
  "properties": {
    "schema_version": {
      "const": "1.1.0"
    },
    "bundle_kind": {
      "const": "evidence-bundle"
    },
    "generated_at": {
      "type": "string"
    },
    "source_analysis_path": {
      "type": "string"
    },
    "source_analysis_sha256": {
      "type": ["string", "null"],
      "pattern": "^[a-f0-9]{64}$"
    },
    "source_input_path": {
      "type": ["string", "null"]
    },
    "source_input_paths": {
      "type": "array",
      "items": {
        "type": "string"
      }
    },
    "source_input_hashes": {
      "type": "array",
      "items": {
        "$ref": "#/$defs/inputHash"
      }
    },
    "provider_snapshot": {
      "type": "object",
      "additionalProperties": true
    },
    "artifact_hashes": {
      "type": "object",
      "additionalProperties": {
        "type": "string",
        "pattern": "^[a-f0-9]{64}$"
      }
    },
    "findings_count": {
      "type": "integer"
    },
    "kev_hits": {
      "type": "integer"
    },
    "waived_count": {
      "type": "integer"
    },
    "attack_mapped_cves": {
      "type": "integer"
    },
    "included_input_copy": {
      "type": "boolean"
    },
    "redaction": {
      "type": "object",
      "additionalProperties": true,
      "properties": {
        "enabled": {
          "type": "boolean"
        },
        "policy": {
          "type": "string"
        },
        "redacted_keys": {
          "type": "array",
          "items": {
            "type": "string"
          }
        }
      }
    },
    "files": {
      "type": "array",
      "items": {
        "$ref": "#/$defs/evidenceFile"
      }
    }
  },
  "$defs": {
    "evidenceFile": {
      "type": "object",
      "additionalProperties": true,
      "required": ["path", "kind", "size_bytes", "sha256"],
      "properties": {
        "path": {
          "type": "string"
        },
        "kind": {
          "type": "string"
        },
        "size_bytes": {
          "type": "integer"
        },
        "sha256": {
          "type": "string",
          "pattern": "^[a-f0-9]{64}$"
        }
      }
    },
    "inputHash": {
      "type": "object",
      "additionalProperties": false,
      "required": ["path", "size_bytes", "sha256"],
      "properties": {
        "path": {
          "type": "string"
        },
        "size_bytes": {
          "type": "integer"
        },
        "sha256": {
          "type": "string",
          "pattern": "^[a-f0-9]{64}$"
        }
      }
    }
  }
}
