{
  "artifact_hashes": {
    "analysis.json": "1dcfd60ab3b9c3cdb64851a02255630af132439125ada32526a0085112af473f",
    "executive.html": "e44d93aec9cf4dc0986f8d626e4a6097b7ae92d6757376cbaedbc1fd71d9d05b",
    "findings.csv": "3901094bf4ec701b7ffdb53394590980732adf806ffbb65618d11114e8c26d60",
    "provider-snapshot.json": "f5dab115122d78f3ac437386b83f2b5341e2694f0db909ca8cac111cdb57fea0",
    "results.sarif": "52b86b87ed3e2dbb5899a571aeb60b07be10e70cf4722733a5c7628bdd55d642",
    "technical.md": "2b7d2ebf5fab7c68a7451333c07fb736682c9a7ae964932db46dea3d0c877ded"
  },
  "attack_mapped_cves": 1,
  "bundle_kind": "evidence-bundle",
  "files": [
    {
      "kind": "analysis-json",
      "path": "analysis.json",
      "sha256": "1dcfd60ab3b9c3cdb64851a02255630af132439125ada32526a0085112af473f",
      "size_bytes": 7702
    },
    {
      "kind": "technical-markdown",
      "path": "technical.md",
      "sha256": "2b7d2ebf5fab7c68a7451333c07fb736682c9a7ae964932db46dea3d0c877ded",
      "size_bytes": 1766
    },
    {
      "kind": "executive-html",
      "path": "executive.html",
      "sha256": "e44d93aec9cf4dc0986f8d626e4a6097b7ae92d6757376cbaedbc1fd71d9d05b",
      "size_bytes": 55790
    },
    {
      "kind": "provider-snapshot",
      "path": "provider-snapshot.json",
      "sha256": "f5dab115122d78f3ac437386b83f2b5341e2694f0db909ca8cac111cdb57fea0",
      "size_bytes": 548
    },
    {
      "kind": "findings-csv",
      "path": "findings.csv",
      "sha256": "3901094bf4ec701b7ffdb53394590980732adf806ffbb65618d11114e8c26d60",
      "size_bytes": 974
    },
    {
      "kind": "sarif-results",
      "path": "results.sarif",
      "sha256": "52b86b87ed3e2dbb5899a571aeb60b07be10e70cf4722733a5c7628bdd55d642",
      "size_bytes": 6964
    }
  ],
  "findings_count": 2,
  "generated_at": "2026-04-29T12:00:00Z",
  "included_input_copy": false,
  "kev_hits": 1,
  "provider_snapshot": {
    "bundle_path": "provider-snapshot.json",
    "content_hash": "sha256:vpw050-snapshot",
    "id": "00000000-0000-4000-8000-000000000650",
    "sha256": "f5dab115122d78f3ac437386b83f2b5341e2694f0db909ca8cac111cdb57fea0"
  },
  "redaction": {
    "enabled": true,
    "policy": "sensitive keys and local path fields are replaced with [REDACTED]",
    "redacted_keys": [
      "analysis_run.error_message",
      "analysis_run.errors.authorization",
      "analysis_run.summary.input_upload.path",
      "analysis_run.summary.input_upload.token",
      "findings.0.evidence.authorization",
      "findings.0.evidence.upload_path",
      "findings.0.rationale",
      "findings.0.recommended_action",
      "findings.[].evidence.authorization",
      "provider_snapshot.source_metadata.api_key",
      "provider_snapshot.source_metadata.cache_dir",
      "provider_snapshot.source_metadata.source_path",
      "source_metadata.api_key"
    ]
  },
  "schema_version": "1.1.0",
  "source_analysis_path": "analysis.json",
  "source_analysis_sha256": "1dcfd60ab3b9c3cdb64851a02255630af132439125ada32526a0085112af473f",
  "source_input_hashes": [
    {
      "path": "known-cves.txt",
      "sha256": "aaaaaaaaaaaaaaaaaaaaaaaaaaaaaaaaaaaaaaaaaaaaaaaaaaaaaaaaaaaaaaaa",
      "size_bytes": 29
    }
  ],
  "source_input_path": "known-cves.txt",
  "source_input_paths": [
    "known-cves.txt"
  ],
  "waived_count": 0
}
